<?xml version="1.0" encoding="UTF-8"?>
<agencia xmlns:xsi="http://www.w3.org/2001/XMLSchema-instance"
    xsi:noNamespaceSchemaLocation="Ejercicio5.xsd">
    <paquetes>
        <paquete codigo="PKT-1234">
            <destino>Granada</destino>
            <precio>19.35</precio>
            <fechaInicio>2025-10-06</fechaInicio>
            <fechaFin>2025-10-06</fechaFin>
            <tipo>Aventura</tipo>
            <clientes>
                <cliente>
                    <nombre>Evaristo</nombre>
                    <dni>12345678X</dni>
                    <edad>25</edad>
                    <email>a@a.com</email>
                </cliente>
                <cliente>
                    <nombre>Evaristo</nombre>
                    <dni>12345678X</dni>
                    <edad>25</edad>
                    <email>a@a.com</email>
                </cliente>
            </clientes>
        </paquete>
        <paquete codigo="PKT-1234">
            <destino>Granada</destino>
            <precio>19.35</precio>
            <fechaInicio>2025-10-06</fechaInicio>
            <fechaFin>2025-10-06</fechaFin>
            <tipo>Aventura</tipo>
            <clientes>
                <cliente>
                    <nombre>Evaristo</nombre>
                    <dni>12345678X</dni>
                    <edad>25</edad>
                    <email>a@a.com</email>
                </cliente>
            </clientes>
        </paquete>
    </paquetes>
</agencia>